{
  "corpus_schema": "rcs-003-corpus/1.0",
  "corpus_id": "radiCADSAC-adversarial-manufacturing",
  "version": "1.0.0",
  "policy_refs": {
    "units": "si-mm-rad-s-v1",
    "frames": "right-handed-z-up-workpiece-v1",
    "tolerance": "rcs-003-fixture-policy-v1",
    "result_policy": "physical-intent-v1"
  },
  "fixture_families": [
    {
      "id": "lathe-repeated-finishing-pass",
      "revision": 1,
      "domain": "lathe",
      "tags": ["retrace", "coincidence", "redundant-operation"],
      "physical_intent": "Repeat an already completed finishing pass on the same cylindrical surface without removing additional material.",
      "setup": {"units": "mm", "frame": "right-handed-z-up-workpiece-v1", "stock": "cylinder diameter 40 length 60", "operation_model": "fixed-axis OD turning"},
      "parameter_axes": [{"name": "repeat_count", "unit": "count", "values": [1, 2, 10, 100, 1000]}, {"name": "radial_offset", "unit": "mm", "values": [0, 0.0001, 0.001]}],
      "expected": {"classification": "no_material_change", "body_count": 1, "connectivity": "unchanged"},
      "oracle": "At zero radial offset, every repeat after the first preserves the same physical material boundary and one connected retained body.",
      "minimization_preserves": ["original first pass", "at least one exact repeat", "same tool envelope", "same setup"]
    },
    {
      "id": "lathe-sub-tolerance-skim",
      "revision": 1,
      "domain": "lathe",
      "tags": ["sub-tolerance", "sliver", "small-removal"],
      "physical_intent": "Remove a deliberately tiny radial layer whose depth sweeps across numerical and manufacturing tolerance scales.",
      "setup": {"units": "mm", "frame": "right-handed-z-up-workpiece-v1", "stock": "finished cylinder diameter 40 length 40", "operation_model": "fixed-axis OD turning"},
      "parameter_axes": [{"name": "cut_depth", "unit": "mm", "values": [0.000001, 0.00001, 0.0001, 0.001, 0.01]}, {"name": "axial_length", "unit": "mm", "values": [1, 10, 30]}],
      "expected": {"classification": "regularized_material_change", "body_count": 1, "connectivity": "connected"},
      "oracle": "Any strictly positive commanded depth is physical removal intent; the harness may separately classify whether a backend resolves it within its declared policy.",
      "minimization_preserves": ["positive commanded depth", "pre-existing finished surface", "one retained body"]
    },
    {
      "id": "lathe-tangent-shoulder-contact",
      "revision": 1,
      "domain": "lathe",
      "tags": ["tangency", "lower-dimensional-contact", "shoulder"],
      "physical_intent": "Move a turning envelope tangentially into an existing shoulder without a volumetric overlap at the limiting case.",
      "setup": {"units": "mm", "frame": "right-handed-z-up-workpiece-v1", "stock": "stepped cylinder", "operation_model": "OD turning shoulder approach"},
      "parameter_axes": [{"name": "normal_offset", "unit": "mm", "values": [-0.01, -0.0001, 0, 0.0001, 0.01]}, {"name": "nose_radius", "unit": "mm", "values": [0, 0.4, 0.8]}],
      "expected": {"classification": "no_material_change", "body_count": 1, "connectivity": "unchanged"},
      "oracle": "The exact tangent member has no volumetric removal; signed offsets on either side distinguish clearance from real overlap.",
      "minimization_preserves": ["tangent limiting member", "existing shoulder", "signed offset sweep"]
    },
    {
      "id": "lathe-facing-existing-plane",
      "revision": 1,
      "domain": "lathe",
      "tags": ["coplanarity", "retrace", "face"],
      "physical_intent": "Face exactly to a previously established end plane, including repeated facing passes at the same axial coordinate.",
      "setup": {"units": "mm", "frame": "right-handed-z-up-workpiece-v1", "stock": "cylinder with finished end face", "operation_model": "facing"},
      "parameter_axes": [{"name": "axial_offset", "unit": "mm", "values": [-0.001, 0, 0.001]}, {"name": "repeat_count", "unit": "count", "values": [1, 2, 100]}],
      "expected": {"classification": "no_material_change", "body_count": 1, "connectivity": "unchanged"},
      "oracle": "The zero-offset repeated face pass leaves the material set unchanged; negative/positive offsets bracket removal and clearance semantics.",
      "minimization_preserves": ["existing plane", "zero-offset pass", "at least one repeat"]
    },
    {
      "id": "lathe-od-id-surface-retrace",
      "revision": 1,
      "domain": "lathe",
      "tags": ["retrace", "od-id", "coincidence"],
      "physical_intent": "Retrace already finished outside and inside cylindrical boundaries with fixed-axis tools.",
      "setup": {"units": "mm", "frame": "right-handed-z-up-workpiece-v1", "stock": "tube-like turned workpiece", "operation_model": "OD and ID turning"},
      "parameter_axes": [{"name": "surface", "unit": "enum", "values": ["od", "id"]}, {"name": "repeat_count", "unit": "count", "values": [1, 10, 500]}],
      "expected": {"classification": "no_material_change", "body_count": 1, "connectivity": "unchanged"},
      "oracle": "Exact envelope retracing of the established OD or ID boundary must not invent removal, addition, or new bodies.",
      "minimization_preserves": ["pre-existing cylindrical boundary", "exact retrace", "OD or ID classification"]
    },
    {
      "id": "lathe-bore-shoulder-meeting",
      "revision": 1,
      "domain": "lathe",
      "tags": ["coincidence", "shoulder", "internal"],
      "physical_intent": "Bore to an existing internal shoulder so the cylindrical bore boundary meets the shoulder plane exactly or by a controlled signed offset.",
      "setup": {"units": "mm", "frame": "right-handed-z-up-workpiece-v1", "stock": "blind bored cylinder", "operation_model": "ID boring"},
      "parameter_axes": [{"name": "axial_offset", "unit": "mm", "values": [-0.01, -0.0001, 0, 0.0001, 0.01]}, {"name": "bore_diameter", "unit": "mm", "values": [10, 20, 30]}],
      "expected": {"classification": "regularized_material_change", "body_count": 1, "connectivity": "connected"},
      "oracle": "The operation removes only intended bore material; exact plane meeting must neither leave a zero-thickness membrane nor over-cut the shoulder.",
      "minimization_preserves": ["blind shoulder", "bore surface", "zero-offset member"]
    },
    {
      "id": "lathe-path-reversal",
      "revision": 1,
      "domain": "lathe",
      "tags": ["path-reversal", "retrace", "operation-order"],
      "physical_intent": "Traverse an engaged finishing path and immediately reverse along the same path without additional intended stock removal on the return.",
      "setup": {"units": "mm", "frame": "right-handed-z-up-workpiece-v1", "stock": "cylinder diameter 40 length 60", "operation_model": "OD turning"},
      "parameter_axes": [{"name": "reversal_count", "unit": "count", "values": [1, 2, 20, 200]}, {"name": "path_length", "unit": "mm", "values": [1, 10, 50]}],
      "expected": {"classification": "no_material_change", "body_count": 1, "connectivity": "unchanged"},
      "oracle": "Once the forward pass establishes the surface, exact reverse traversals preserve the same material set.",
      "minimization_preserves": ["forward pass", "immediate reverse pass", "identical tool envelope"]
    },
    {
      "id": "lathe-noisy-analogue-feed",
      "revision": 1,
      "domain": "lathe",
      "tags": ["noise", "high-segment-count", "canonicalization"],
      "physical_intent": "Represent natural analogue-control jitter around a nominal cylindrical finishing feed without turning sampling noise into arbitrary topology.",
      "setup": {"units": "mm", "frame": "right-handed-z-up-workpiece-v1", "stock": "cylinder diameter 40 length 60", "operation_model": "OD turning canonical trajectory"},
      "parameter_axes": [{"name": "radial_noise_amplitude", "unit": "mm", "values": [0, 0.0001, 0.001, 0.01]}, {"name": "sample_count", "unit": "count", "values": [10, 1000, 100000]}],
      "expected": {"classification": "regularized_material_change", "body_count": 1, "connectivity": "connected"},
      "oracle": "Material removal follows the canonicalized envelope within declared trajectory bounds; connectivity remains one retained body.",
      "minimization_preserves": ["nominal feed", "noise amplitude", "canonicalization bound", "seed or explicit samples"]
    },
    {
      "id": "lathe-long-redundant-sequence",
      "revision": 1,
      "domain": "lathe",
      "tags": ["topology-explosion", "large-operation-count", "retrace"],
      "physical_intent": "Apply a very long sequence of mostly redundant finishing operations to test operation-count scaling and topology stability.",
      "setup": {"units": "mm", "frame": "right-handed-z-up-workpiece-v1", "stock": "cylinder diameter 40 length 60", "operation_model": "OD turning"},
      "parameter_axes": [{"name": "operation_count", "unit": "count", "values": [10, 100, 1000, 10000]}, {"name": "distinct_depth_count", "unit": "count", "values": [1, 2, 8]}],
      "expected": {"classification": "regularized_material_change", "body_count": 1, "connectivity": "connected"},
      "oracle": "Only distinct deeper envelopes change material; redundant repeats must not multiply physical boundaries or alter retained-body connectivity.",
      "minimization_preserves": ["long history", "redundant repeats", "at least one real removal"]
    },
    {
      "id": "lathe-parting-cut-through",
      "revision": 1,
      "domain": "lathe",
      "tags": ["separation", "cut-through", "multi-body"],
      "physical_intent": "Part completely through a cylindrical workpiece so retained material becomes two disconnected volumetric bodies before any user-facing scrap policy is applied.",
      "setup": {"units": "mm", "frame": "right-handed-z-up-workpiece-v1", "stock": "cylinder diameter 40 length 80", "operation_model": "radial parting"},